Name,Description,Starts,Issues,Pull Requests,Forks,Website
https://github.com/resemble-ai/chatterbox,SoTA open-source TTS,"12,662",251,110,"1,606",https://resemble-ai.github.io/chatterbox_demopage/
https://github.com/simstudioai/sim,Open-source platform to build and deploy AI agent workflows.,"14,774","1,304","1,077","1,835",https://www.sim.ai
https://github.com/oraios/serena,A powerful coding agent toolkit providing semantic retrieval and editing capabilities (MCP server & other integrations),"12,124",545,245,832,
https://github.com/getzep/graphiti,Build Real-Time Knowledge Graphs for AI Agents,"18,019",835,641,"1,618",https://help.getzep.com/graphiti
https://github.com/11cafe/jaaz,The world's first open-source multimodal creative assistant  This is a substitute for Canva and Manus that prioritizes privacy and is usable locally.,"4,313",220,226,354,https://jaaz.app
https://github.com/rowboatlabs/rowboat,AI-powered multi-agent builder,"3,466",200,195,317,https://www.rowboatlabs.com
https://github.com/0x4m4/hexstrike-ai,"HexStrike AI MCP Agents is an advanced MCP server that lets AI agents (Claude, GPT, Copilot, etc.) autonomously run 150+ cybersecurity tools for automated pentesting, vulnerability discovery, bug bounty automation, and security research. Seamlessly bridge LLMs with real-world offensive security capabilities.","2,791",55,8,675,https://www.hexstrike.com/
https://github.com/VectifyAI/PageIndex,📄🧠 PageIndex: Document Index for Reasoning-based RAG,"2,464",17,17,190,https://pageindex.ai
https://github.com/Mooncake-Labs/pg_mooncake,Real-time analytics on Postgres tables,"1,665",135,68,46,https://mooncake.dev/
https://github.com/nari-labs/dia,A TTS model capable of generating ultra-realistic dialogue in one pass.,"18,336",235,93,"1,559",https://narilabs.org/
https://github.com/twentyhq/twenty,"Building a modern alternative to Salesforce, powered by the community.","35,390","9,821","8,397","4,130",https://twenty.com
https://github.com/boundaryml/baml,The AI framework that adds the engineering to prompt engineering (Python/TS/Ruby/Java/C#/Rust/Go compatible),"5,778","2,404","1,812",270,https://docs.boundaryml.com
https://github.com/stagewise-io/stagewise,stagewise is the first frontend coding agent for existing production-grade web apps 🪄  -- Lives inside your browser 💻 -- Makes changes in local codebase 🤓 -- Compatible with all kinds of frameworks and setups 💪,"6,138",605,552,366,https://stagewise.io
https://github.com/M4THYOU/TokenDagger,High-Performance Implementation of OpenAI's TikToken.,451,4,0,10,
https://github.com/CopilotKit/CopilotKit,"React UI + elegant infrastructure for AI Copilots, AI chatbots, and in-app AI agents. The Agentic last-mile 🪁","22,858","2,403","1,818","3,081",https://docs.copilotkit.ai
https://github.com/onkernel/kernel-images,Browsers-as-a-service for automations and web agents,523,9,59,27,https://www.onkernel.com
https://github.com/superglue-ai/superglue,"superglue integrates & orchestrates APIs from natural language. Agents use it to build deterministic workflows across apps, APIs and databases. Humans use it to generate insights, build automations and manage data.","1,904",203,250,99,https://superglue.ai
https://github.com/Operative-Sh/web-eval-agent,An MCP server that autonomously evaluates web applications. ,"1,181",11,24,97,https://www.operative.sh/mcp
https://github.com/yichuan-w/LEANN,"RAG on Everything with LEANN. Enjoy 97% storage savings while running a fast, accurate, and 100% private RAG application on your personal device.","2,516",40,52,232,
https://github.com/sirius-db/sirius,,436,45,33,11,https://www.sirius-db.com
https://github.com/agentscope-ai/agentscope,AgentScope: Agent-Oriented Programming for Building LLM Applications,"11,099",725,494,764,https://doc.agentscope.io/
https://github.com/agent0ai/agent-zero,Agent Zero AI framework,"11,709",647,318,"2,287",https://agent-zero.ai
https://github.com/dyad-sh/dyad,"Free, local, open-source AI app builder ✨ v0 / lovable / Bolt alternative 🌟 Star if you like it!","14,680","1,204",495,"1,475",https://dyad.sh
https://github.com/GraphiteEditor/Graphite,"An open source graphics editor for 2025: comprehensive 2D content creation tool suite for graphic design, digital art, and interactive real-time motion graphics — featuring node-based procedural editing","21,086","3,100","1,884",889,https://graphite.rs
https://github.com/livestorejs/livestore,LiveStore is a next-generation state management framework based on reactive SQLite and built-in sync engine.,"2,965",606,333,88,https://livestore.dev
https://github.com/pathwaycom/pathway,"Python ETL framework for stream processing, real-time analytics, LLM pipelines, and RAG.","42,443",112,14,"1,292",https://pathway.com
https://github.com/onlook-dev/onlook,"The Cursor for Designers • An Open-Source AI-First Design tool • Visually build, style, and edit your React App with AI","22,447","2,718","1,878","1,554",https://onlook.com
https://github.com/SuperClaude-Org/SuperClaude_Framework,"A configuration framework that enhances Claude Code with specialized commands, cognitive personas, and development methodologies.","15,411",245,103,"1,371",https://superclaude.netlify.app/
https://github.com/MiniMax-AI/MiniMax-01,"The official repo of MiniMax-Text-01 and MiniMax-VL-01, large-language-model & vision-language-model based on Linear Attention","3,139",53,13,289,https://www.minimax.io/
https://github.com/windmill-labs/windmill,"Open-source developer platform to power your entire infra and turn scripts into webhooks, workflows and UIs. Fastest workflow engine (13x vs Airflow). Open-source alternative to Retool and Temporal.","14,570","6,416","5,267",786,https://windmill.dev
https://github.com/Skyvern-AI/skyvern,Automate browser-based workflows with LLMs and Computer Vision,"14,240","3,304","3,091","1,196",https://www.skyvern.com
https://github.com/triggerdotdev/trigger.dev,Trigger.dev – build and deploy fully‑managed AI agents and workflows,"12,252","2,408","1,854",811,https://trigger.dev/changelog
https://github.com/keephq/keep,The open-source AIOps and alert management platform,"10,658","5,229","2,911","1,053",https://keephq.dev
https://github.com/explodinggradients/ragas,Supercharge Your LLM Application Evaluations 🚀,"10,681","2,219","1,129","1,070",https://docs.ragas.io
https://github.com/activeloopai/deeplake,"Database for AI. Store Vectors, Images, Texts, Videos, etc. Use with LLMs/LangChain. Store, query, version, & visualize any AI data. Stream data in real-time to PyTorch/TensorFlow. https://activeloop.ai","8,812","3,006","2,552",677,https://activeloop.ai
https://github.com/hyperdxio/hyperdx,"Resolve production issues, fast. An open source observability platform unifying session replays, logs, metrics, traces and errors powered by Clickhouse and OpenTelemetry.","8,847","1,112",955,307,https://hyperdx.io/
https://github.com/highlight/highlight,"highlight.io: The open source, full-stack monitoring platform. Error monitoring, session replay, logging, distributed tracing, and more.","8,656","9,845","7,427",456,https://app.highlight.io
https://github.com/getlago/lago,"Open Source Metering and Usage Based Billing API ⭐️ Consumption tracking, Subscription management, Pricing iterations, Payment orchestration & Revenue analytics","8,446",514,361,441,https://www.getlago.com
https://github.com/paradedb/paradedb,"ParadeDB is a modern Elasticsearch alternative built on Postgres. Built for real-time, update-heavy workloads.","7,730","3,008","2,328",273,https://paradedb.com
https://github.com/firezone/firezone,Enterprise-ready zero-trust access platform built on WireGuard®.,"7,506","9,831","7,326",334,https://www.firezone.dev
https://github.com/growthbook/growthbook,Open Source Feature Flagging and A/B Testing Platform,"6,847","4,516","3,321",596,https://www.growthbook.io
https://github.com/shuttle-hq/shuttle,Build & ship backends without writing any infrastructure files.,"6,650","2,006","1,697",277,https://shuttle.dev
https://github.com/evidentlyai/evidently,"Evidently is ​​an open-source ML and LLM observability framework. Evaluate, test, and monitor any AI-powered system or data pipeline. From tabular data to Gen AI. 100+ metrics.","6,600","1,702","1,254",723,https://discord.gg/xZjKRaNp8b
https://github.com/traceloop/openllmetry,"Open-source observability for your LLM application, based on OpenTelemetry","6,389","3,308","3,063",798,https://www.traceloop.com/openllmetry
https://github.com/superagent-ai/superagent,The worlds first purpose-built firewall for AI,"6,118","1,009",631,937,https://superagent.sh
https://github.com/authzed/spicedb,"Open Source, Google Zanzibar-inspired database for scalably storing and querying fine-grained authorization data","6,017","2,409","1,962",341,https://authzed.com/docs
https://github.com/hatchet-dev/hatchet,🪓 Run Background Tasks at Scale,"6,019","2,202","1,996",262,https://hatchet.run
https://github.com/NangoHQ/nango,A single API for all your integrations.,"5,848","4,601","3,794",543,https://www.nango.dev
https://github.com/lightdash/lightdash,Self-serve BI to 10x your data team ⚡️,"5,090","9,854","8,714",611,https://lightdash.com
https://github.com/ArroyoSystems/arroyo,Distributed stream processing engine in Rust,"4,515",901,702,303,https://arroyo.dev
https://github.com/Helicone/helicone,"🧊 Open source LLM observability platform. One line of code to monitor, evaluate, and experiment. YC W23 🍓","4,488","4,201","4,499",433,https://www.helicone.ai
https://github.com/rivet-gg/rivet,Scale and orchestrate RivetKit,"4,366","2,800","2,505",113,https://rivet.gg
https://github.com/defog-ai/sqlcoder,SoTA LLM for converting natural language questions to SQL queries,"3,883",125,11,262,
https://github.com/requestly/requestly,Free and open-source API Client & Interceptor.,"3,976","3,405","2,843",335,https://requestly.com
https://github.com/vocodedev/vocode-core,🤖 Build voice-based LLM agents. Modular + open source.,"3,440",717,568,622,https://vocode.dev
https://github.com/fern-api/fern,Input OpenAPI. Output SDKs and Docs.,"3,308","9,300","8,033",244,https://buildwithfern.com
https://github.com/OpenPipe/OpenPipe,Turn expensive prompts into cheap fine-tuned models,"2,730",700,644,160,https://openpipe.ai
https://github.com/questdb/questdb,"QuestDB is a high performance, open-source, time-series database","16,082","5,925","3,811","1,472",https://questdb.com
https://github.com/langfuse/langfuse,"🪢 Open source LLM engineering platform: LLM Observability, metrics, evals, prompt management, playground, datasets. Integrates with OpenTelemetry, Langchain, OpenAI SDK, LiteLLM, and more. 🍊YC W23 ","16,053","6,815","5,100","1,497",https://langfuse.com/docs
https://github.com/supertokens/supertokens-core,Open source alternative to Auth0 / Firebase Auth / AWS Cognito ,"14,498","1,111",636,609,https://supertokens.com
https://github.com/Eventual-Inc/Daft,Distributed query engine providing simple and reliable data processing for any modality and scale,"4,337","5,003","3,778",296,https://daft.ai
https://github.com/bytebot-ai/bytebot,"Bytebot is a self-hosted AI desktop agent that automates computer tasks through natural language commands, operating within a containerized Linux desktop environment.","6,728",111,72,733,https://www.bytebot.ai/
https://github.com/kestra-io/kestra,":zap: Universal Workflow Orchestration Platform — Code in any language, run anywhere. 900+ plugins for data, infrastructure, and AI automation.","21,129","9,823","6,762","1,809",https://kestra.io
https://github.com/emcie-co/parlant,LLM agents built for control. Designed for real-world use. Deployed in minutes.,"11,778",504,412,943,https://www.parlant.io
https://github.com/documenso/documenso,The Open Source DocuSign Alternative.,"11,589","1,822","1,296","1,960",https://documenso.com
https://github.com/makeplane/plane,"🔥 🔥 🔥 Open Source JIRA, Linear, Monday, and Asana Alternative. Plane helps you track your issues, epics, and cycles the easiest way on the planet.","38,697","7,600","6,270","2,687",http://plane.so
https://github.com/formbricks/formbricks,Open Source Qualtrics Alternative,"11,241","6,218","4,096","1,990",https://formbricks.com
https://github.com/erxes/erxes,Source available experience management infrastructure. Pioneering the future of experiences with XOS (Experience Operating System). Hubspot + Qualtrics alternative,"3,681","6,001","3,772","1,166",https://erxes.io
https://github.com/novuhq/novu,"The open-source notification Inbox infrastructure. E-mail, SMS, Push and Slack Integrations.","37,755","8,900","7,309","4,110",https://novu.co
https://github.com/knadh/listmonk,"High performance, self-hosted, newsletter and mailing list manager with a modern dashboard. Single binary app.","17,782","2,550",614,"1,740",https://listmonk.app
https://github.com/paperless-ngx/paperless-ngx,"A community-supported supercharged document management system: scan, index and archive all your documents","31,942","5,322","3,243","1,952",http://docs.paperless-ngx.com/
https://github.com/OpenBB-finance/OpenBB,"Financial data platform for analysts, quants and AI agents.","52,175","6,922","4,734","4,954",https://openbb.co
https://github.com/rowyio/rowy,"Low-code backend platform. Manage database on spreadsheet-like UI and build cloud functions workflows in JS/TS, all in your browser.","6,729","1,115",721,539,http://rowy.io
https://github.com/Infisical/infisical,"Infisical is the open-source platform for secrets management, PKI, and SSH access.","20,053","4,209","3,238","1,349",https://infisical.com
https://github.com/teableio/teable,✨ The Next Gen Airtable Alternative: No-Code Postgres,"19,482","1,715","1,394","1,021",https://teable.ai
https://github.com/logto-io/logto,"🧑‍🚀 Authentication and authorization infrastructure for SaaS and AI apps, built on OIDC and OAuth 2.1 with multi-tenancy, SSO, and RBAC.","10,748","7,617","6,960",615,https://logto.io
https://github.com/Unleash/unleash,Open-source feature management platform,"12,608","9,804","9,686",792,https://www.getunleash.io
https://github.com/appsmithorg/appsmith,"Platform to build admin panels, internal tools, and dashboards. Integrates with 25+ databases and any API.","37,945","9,852","17,461","4,228",https://www.appsmith.com
https://github.com/ToolJet/ToolJet,"ToolJet is the open-source foundation of ToolJet AI - the AI-native platform for building internal tools, dashboard, business applications, workflows and AI agents 🚀","36,445","9,841","8,798","4,742",https://tooljet.ai
https://github.com/fonoster/fonoster,🚀 The open-source alternative to Twilio.,"6,997",700,550,417,https://fonoster.com
https://github.com/jitsucom/jitsu,"Jitsu is an open-source Segment alternative. Fully-scriptable data ingestion engine for modern data teams. Set-up a real-time data pipeline in minutes, not days","4,398","1,213",623,315,https://jitsu.com
https://github.com/Avaiga/taipy,Turns Data and AI algorithms into production-ready web applications in no time.,"18,618","2,526","1,512","1,926",https://www.taipy.io
https://github.com/go-skynet/LocalAI,":robot: The free, Open Source alternative to OpenAI, Claude and others. Self-hosted and local-first. Drop-in replacement for OpenAI,  running on consumer-grade hardware. No GPU required. Runs gguf, transformers, diffusers and many more models architectures. Features: Generate Text, Audio, Video, Images, Voice Cloning, Distributed, P2P inference","35,178","5,901","4,796","2,759",https://localai.io
https://github.com/chroma-core/chroma,Open-source search and retrieval database for AI applications.,"23,247","5,404","3,965","1,822",https://www.trychroma.com/
https://github.com/weaviate/weaviate,"Weaviate is an open-source vector database that stores both objects and vectors, allowing for the combination of vector search with structured filtering with the fault tolerance and scalability of a cloud-native database​.","14,550","9,101","6,524","1,076",https://weaviate.io/developers/weaviate/
https://github.com/qdrant/qdrant,"Qdrant - High-performance, massive-scale Vector Database and Vector Search Engine for the next generation of AI. Also available in the cloud https://cloud.qdrant.io/","25,875","6,816","5,314","1,809",https://qdrant.tech
https://github.com/milvus-io/milvus,"Milvus is a high-performance, cloud-native vector database built for scalable vector ANN search","37,128","9,815","26,649","3,391",https://milvus.io
https://github.com/marqo-ai/marqo,Unified embedding generation and search engine. Also available on cloud - cloud.marqo.ai,"4,938","1,204","1,030",214,https://www.marqo.ai/
https://github.com/typesense/typesense,"Open Source alternative to Algolia + Pinecone and an Easier-to-Use alternative to ElasticSearch ⚡ 🔍 ✨ Fast, typo tolerant, in-memory fuzzy Search Engine for building delightful search experiences","24,317","2,503",761,807,https://typesense.org
https://github.com/zincsearch/zincsearch,"ZincSearch . A lightweight alternative to elasticsearch that requires minimal resources, written in Go.","17,539",923,635,759,https://zincsearch-docs.zinc.dev
https://github.com/quickwit-oss/quickwit,"Cloud-native search engine for observability. An open-source alternative to Datadog, Elasticsearch, Loki, and Tempo.","10,402","5,804","3,404",485,https://quickwit.io
https://github.com/openobserve/openobserve,"🚀 10x easier, 🚀 140x lower storage cost, 🚀 high performance,  🚀 petabyte scale - Elasticsearch/Splunk/Datadog alternative for 🚀 (logs, metrics, traces, RUM, Error tracking, Session replay).","16,557","8,213","5,494",650,https://openobserve.ai
https://github.com/grafana/loki,"Like Prometheus, but for logs.","26,413","9,830","13,629","3,782",https://grafana.com/loki
https://github.com/VictoriaMetrics/VictoriaMetrics,"VictoriaMetrics: fast, cost-effective monitoring solution and time series database","14,986","9,201","4,887","1,456",https://victoriametrics.com/
https://github.com/cortexproject/cortex,"A horizontally scalable, highly available, multi-tenant, long term Prometheus.","5,671","6,900","4,931",831,https://cortexmetrics.io/
https://github.com/thanos-io/thanos,Highly available Prometheus setup with long term storage capabilities. A CNCF Incubating project.,"13,695","7,917","5,096","2,203",https://thanos.io
https://github.com/m3db/m3,"M3 monorepo - Distributed TSDB, Aggregator and Query Engine, Prometheus Sidecar, Graphite Compatible, Metrics Platform","4,847","4,305","3,713",464,https://m3db.io/
https://github.com/skypilot-org/skypilot,"Run, manage, and scale AI workloads on any AI infrastructure. Use one system to access & manage all AI compute (Kubernetes, 17+ clouds, or on-prem).","8,697",343,143,771,https://docs.skypilot.co/en/latest/docs/index.html
https://github.com/semaphoreio/semaphore,Semaphore is an open source CI/CD platform. Self-host Semaphore on your own servers or on a cloud provider.,"1,300",76,13,62,https://semaphore.io/
https://github.com/robotmcp/ros-mcp-server,Connect AI models like Claude & GPT with robots using MCP and ROS.,414,11,2,70,